{
  "name": "testing",
  "version": "1.0.0",
  "uri": "testing",
  "type": "ecosystem",
  "context": "Run and write automated tests — unit, integration, end-to-end — across JavaScript, TypeScript, and Python projects",
  "info": "The testing ecosystem covers the full spectrum of automated testing for software projects. It spans unit testing frameworks (Jest, Vitest, pytest), end-to-end browser testing (Playwright), cross-cutting testing patterns (Arrange-Act-Assert, given-when-then, test factories, test doubles), mocking strategies for isolating units under test, and CI integration for running tests in automated pipelines. Agents use this ecosystem to write new tests, run existing suites, debug failures, configure test infrastructure, and integrate testing into deployment workflows. Each skill node provides framework-specific knowledge with executable scripts, while context nodes teach transferable concepts that apply across frameworks.",
  "parent": null,
  "tags": ["testing", "tests", "unit-tests", "integration-tests", "e2e", "tdd", "test-automation"],
  "aliases": [
    "testing",
    "tests",
    "test suite",
    "test runner",
    "test framework",
    "automated testing",
    "unit testing",
    "integration testing",
    "end-to-end testing",
    "e2e testing",
    "test automation"
  ],
  "triggers": [
    "write tests for this code",
    "run the test suite",
    "add unit tests",
    "set up testing",
    "configure test framework",
    "fix failing tests",
    "add test coverage",
    "write integration tests",
    "set up e2e tests"
  ],
  "body": "# Testing Ecosystem\n\nAutomated testing is the foundation of reliable software delivery. This ecosystem organizes testing knowledge into framework-specific skills and cross-cutting concepts.\n\n## Framework Skills\n\n- **[[testing/jest]]** — The standard test runner for JavaScript and TypeScript projects using CommonJS or legacy setups. Mature ecosystem with built-in mocking, snapshots, and code coverage.\n- **[[testing/vitest]]** — Modern Vite-native test framework for TypeScript and ESM-first projects. API-compatible with Jest but faster, with native ESM and TypeScript support.\n- **[[testing/pytest]]** — The de facto Python testing framework. Fixture-based dependency injection, parametrize for data-driven tests, rich plugin ecosystem.\n- **[[testing/playwright]]** — Cross-browser end-to-end testing. Automates Chromium, Firefox, and WebKit with auto-waiting, network interception, and visual comparisons.\n\n## Cross-Cutting Concepts\n\n- **[[testing/patterns]]** — Structural testing patterns: Arrange-Act-Assert, Given-When-Then, test factories, builder patterns, property-based testing.\n- **[[testing/mocking]]** — Mocking strategies across frameworks: stubs, spies, fakes, dependency injection, when to mock vs. when to use real implementations.\n- **[[testing/ci]]** — Running tests in CI/CD pipelines: GitHub Actions, parallelization, test splitting, flaky test management, coverage reporting.\n\n## Choosing a Framework\n\n| Need | Framework | Why |\n|------|-----------|-----|\n| JS/TS unit tests (CJS/legacy) | [[testing/jest]] | Mature, huge ecosystem, built-in mocking |\n| JS/TS unit tests (ESM/Vite) | [[testing/vitest]] | Native ESM, fast HMR, Jest-compatible API |\n| Python unit/integration tests | [[testing/pytest]] | Fixtures, parametrize, plugin ecosystem |\n| Browser E2E tests | [[testing/playwright]] | Cross-browser, auto-wait, network mocking |\n| API integration tests | [[testing/jest]] or [[testing/vitest]] + supertest | HTTP assertions against running servers |\n| Visual regression | [[testing/playwright]] | Screenshot comparison built in |\n",
  "sections": [
    {
      "id": "framework-selection",
      "title": "Choosing the right framework",
      "body": "For JavaScript/TypeScript projects: use [[testing/vitest]] for new projects (ESM-first, Vite-native, fast) or [[testing/jest]] for existing projects already using Jest or CommonJS. For Python: [[testing/pytest]] is the standard — it runs unittest.TestCase too. For browser testing: [[testing/playwright]] handles all major browsers with a single API. Don't mix unit test frameworks in one project — pick one and stick with it.",
      "tags": ["framework-selection", "vitest-vs-jest", "choosing"]
    },
    {
      "id": "test-pyramid",
      "title": "The test pyramid",
      "body": "The test pyramid guides investment: many fast unit tests at the base, fewer integration tests in the middle, fewest E2E tests at the top. Unit tests (Jest/Vitest/pytest) are fast and cheap — test logic in isolation. Integration tests verify component interactions — database queries, API endpoints, service boundaries. E2E tests (Playwright) verify full user flows through the real UI. Inverting the pyramid (heavy E2E, few unit tests) leads to slow, flaky suites. See [[testing/patterns]] for structural patterns within each layer.",
      "tags": ["test-pyramid", "unit-tests", "integration-tests", "e2e-tests", "strategy"]
    },
    {
      "id": "test-driven-development",
      "title": "Test-driven development",
      "body": "TDD follows the red-green-refactor cycle: write a failing test (red), write the minimum code to pass (green), then refactor while keeping tests green. TDD works well for algorithmic code, business logic, and API contracts. For UI code, write tests after building the component but before shipping. All frameworks in this ecosystem support TDD workflows — see each skill node for framework-specific watch modes and fast feedback loops.",
      "tags": ["tdd", "red-green-refactor", "workflow"]
    }
  ],
  "sub": ["testing/jest", "testing/vitest", "testing/pytest", "testing/playwright", "testing/patterns", "testing/mocking", "testing/ci"],
  "links": [
    { "uri": "testing/jest", "context": "JavaScript/TypeScript testing with Jest" },
    { "uri": "testing/vitest", "context": "Modern Vite-native testing with Vitest" },
    { "uri": "testing/pytest", "context": "Python testing with pytest" },
    { "uri": "testing/playwright", "context": "Cross-browser end-to-end testing" },
    { "uri": "testing/patterns", "context": "Structural testing patterns and strategies" },
    { "uri": "testing/mocking", "context": "Mocking and test double strategies" },
    { "uri": "testing/ci", "context": "Running tests in CI/CD pipelines" }
  ],
  "related": [
    { "uri": "typescript", "relation": "see-also", "note": "TypeScript projects use Jest or Vitest for testing" },
    { "uri": "python", "relation": "see-also", "note": "Python projects use pytest for testing" },
    { "uri": "shell", "relation": "see-also", "note": "Shell scripts run test commands" }
  ],
  "more": {
    "docs": "https://jestjs.io/docs/getting-started",
    "vitest": "https://vitest.dev/guide/",
    "pytest": "https://docs.pytest.org/en/stable/",
    "playwright": "https://playwright.dev/docs/intro"
  },
  "frontmatter": {
    "created": "2026-04-11",
    "updated": "2026-04-11",
    "author": "dojo-community",
    "audience": "developers, AI agents",
    "estimated_reading_time": "3 min",
    "status": "living",
    "confidence": "high"
  },
  "author": "dojo-community",
  "license": "MIT",
  "created": "2026-04-11T00:00:00Z",
  "updated": "2026-04-11T00:00:00Z",
  "status": "published"
}
