{
  "name": "key-vault",
  "uri": "azure/key-vault",
  "type": "skill",
  "context": "Create Key Vaults, assign RBAC, and manage secret values with `az keyvault secret`",
  "info": "Azure Key Vault is the secret boundary for Azure-hosted workloads and deployment automation. Agents use this skill to create vaults, grant the right role assignment for secret operations, set or rotate secret values, retrieve them when absolutely necessary, and delete or purge secrets during cleanup. The CLI surface is `az keyvault` plus ordinary Azure RBAC role assignment commands.",
  "parent": "azure",
  "tags": [
    "azure",
    "key-vault",
    "secrets",
    "rbac",
    "az-keyvault",
    "secret-rotation",
    "vault"
  ],
  "aliases": [
    "azure key vault",
    "keyvault",
    "az keyvault",
    "store secret in azure",
    "azure secrets",
    "retrieve key vault secret",
    "rotate azure secret",
    "grant key vault access"
  ],
  "triggers": [
    "create an azure key vault",
    "store a secret in key vault",
    "read a secret from azure key vault",
    "delete a key vault secret",
    "grant key vault secrets officer",
    "manage azure vault secrets",
    "rotate a secret in azure",
    "set a secret with az keyvault"
  ],
  "body": "# Azure Key Vault\n\nKey Vault secret operations are a combination of two surfaces: create the vault itself, then ensure the executing identity has a role such as `Key Vault Secrets Officer` at the vault scope before attempting secret writes or reads.\n\n~~~bash\n# Create a vault with RBAC-based authorization\naz keyvault create \\\n  --name kv-dojo-prod \\\n  --resource-group rg-dojo-shared \\\n  --location eastus \\\n  --enable-rbac-authorization true\n\n# Grant secret-management rights to a principal\naz role assignment create \\\n  --role \"Key Vault Secrets Officer\" \\\n  --assignee \"$AZURE_ASSIGNEE\" \\\n  --scope \"$(az keyvault show --name kv-dojo-prod --query id -o tsv)\"\n\n# Set and retrieve a secret\naz keyvault secret set --vault-name kv-dojo-prod --name OPENAI_API_KEY --value \"$OPENAI_API_KEY\"\naz keyvault secret show --vault-name kv-dojo-prod --name OPENAI_API_KEY --query value -o tsv\n\n# Delete or purge when cleanup is required\naz keyvault secret delete --vault-name kv-dojo-prod --name OPENAI_API_KEY\naz keyvault secret purge --vault-name kv-dojo-prod --name OPENAI_API_KEY\n~~~\n\nUse Key Vault as the source of truth for sensitive settings consumed by [[azure/app-service]] or [[azure/functions]]. Reading plaintext secret values should be the exception, not the normal control flow. Prefer managed identity and configuration indirection where the runtime can fetch or reference secrets without exposing them back into logs or CI output.\n",
  "sections": [
    {
      "id": "vault-create",
      "title": "Create vaults and enable RBAC",
      "body": "`az keyvault create --enable-rbac-authorization true` creates the vault and leaves authorization in Azure RBAC instead of legacy access policies. That makes permission handling consistent with the rest of Azure automation and easier to reason about from resource IDs and role scopes.",
      "tags": [
        "create",
        "rbac",
        "vault",
        "authorization"
      ]
    },
    {
      "id": "role-assignment",
      "title": "Grant vault-scoped permissions",
      "body": "A principal must have an appropriate role on the vault scope before secret operations succeed. Microsoft Learn's quickstart uses `az role assignment create --role \"Key Vault Secrets Officer\" --assignee ... --scope <vault-id>` as the concrete CLI path. Keep the scope narrow to the specific vault whenever possible.",
      "tags": [
        "role-assignment",
        "scope",
        "secrets-officer",
        "rbac"
      ]
    },
    {
      "id": "secret-lifecycle",
      "title": "Set, show, delete, and purge secrets",
      "body": "`az keyvault secret set` creates or updates a secret, `show` returns the current version, `delete` soft deletes it, and `purge` permanently removes it. Agents should be extremely careful with `show --query value -o tsv` because it converts the secret into plaintext output that can leak into logs.",
      "tags": [
        "secret-set",
        "secret-show",
        "delete",
        "purge"
      ]
    }
  ],
  "links": [
    {
      "uri": "azure/auth",
      "context": "Authenticate as a principal that can receive or use vault-scoped RBAC"
    },
    {
      "uri": "azure/resource-groups",
      "context": "Create the shared or workload-specific group before the vault"
    },
    {
      "uri": "azure/app-service",
      "context": "Use vault-backed secrets instead of hard-coded web app settings"
    },
    {
      "uri": "azure/functions",
      "context": "Store sensitive Function App settings outside deployment manifests"
    },
    {
      "uri": "azure/monitor",
      "context": "Inspect control-plane failures when RBAC or vault operations are rejected"
    }
  ],
  "related": [
    {
      "uri": "azure/auth",
      "relation": "prerequisite",
      "note": "Secret operations require the right principal and RBAC scope"
    },
    {
      "uri": "azure/app-service",
      "relation": "see-also",
      "note": "App Service often consumes secrets stored in Key Vault"
    },
    {
      "uri": "azure/functions",
      "relation": "see-also",
      "note": "Function Apps frequently externalize secrets into Key Vault"
    }
  ],
  "scripts": [
    {
      "id": "manage-key-vault",
      "name": "Manage Key Vault",
      "description": "Create a Key Vault, grant RBAC, and manage secret values with Azure CLI",
      "lang": "bash",
      "runtime": "bash>=4.0, azure-cli>=2.0",
      "entry": "./scripts/manage-key-vault.sh",
      "env": {
        "AZURE_KEY_VAULT_ACTION": {
          "required": true,
          "description": "One of vault-create, grant-secrets-officer, secret-set, secret-show, secret-delete, or secret-purge"
        },
        "AZURE_RESOURCE_GROUP": {
          "required": false,
          "description": "Resource group for vault creation"
        },
        "AZURE_LOCATION": {
          "required": false,
          "description": "Azure region for vault creation"
        },
        "AZURE_KEY_VAULT_NAME": {
          "required": false,
          "description": "Key Vault name"
        },
        "AZURE_KEY_VAULT_ASSIGNEE": {
          "required": false,
          "description": "User, group, or service principal to grant the Key Vault Secrets Officer role"
        },
        "AZURE_SECRET_NAME": {
          "required": false,
          "description": "Secret name"
        },
        "AZURE_SECRET_VALUE": {
          "required": false,
          "secret": true,
          "description": "Secret value for secret-set"
        },
        "AZURE_SUBSCRIPTION_ID": {
          "required": false,
          "description": "Subscription ID or name to activate before the command"
        }
      }
    }
  ],
  "schema": {
    "input": {
      "type": "object",
      "properties": {
        "action": {
          "type": "string",
          "enum": [
            "vault-create",
            "grant-secrets-officer",
            "secret-set",
            "secret-show",
            "secret-delete",
            "secret-purge"
          ]
        },
        "resourceGroup": {
          "type": "string",
          "description": "Resource group name"
        },
        "location": {
          "type": "string",
          "description": "Azure region for vault creation"
        },
        "vaultName": {
          "type": "string",
          "description": "Key Vault name"
        },
        "assignee": {
          "type": "string",
          "description": "Principal to grant the Key Vault Secrets Officer role"
        },
        "secretName": {
          "type": "string",
          "description": "Secret name"
        },
        "secretValue": {
          "type": "string",
          "description": "Secret value for set operations"
        }
      },
      "required": [
        "action"
      ]
    },
    "output": {
      "type": "object",
      "properties": {
        "id": {
          "type": "string",
          "description": "ARM resource ID for the vault or secret"
        },
        "name": {
          "type": "string",
          "description": "Vault or secret name"
        },
        "value": {
          "type": "string",
          "description": "Secret value when explicitly shown"
        }
      }
    }
  },
  "depends": [
    {
      "uri": "azure/auth",
      "reason": "Vault creation and secret operations require a valid Azure identity with RBAC"
    },
    {
      "uri": "azure/resource-groups",
      "reason": "Vaults are created inside a resource group"
    },
    {
      "uri": "shell/bash",
      "reason": "The execution wrapper is implemented in Bash"
    }
  ],
  "more": {
    "secret": "https://learn.microsoft.com/en-us/cli/azure/keyvault/secret?view=azure-cli-latest",
    "quickstart": "https://learn.microsoft.com/en-us/azure/key-vault/secrets/quick-create-cli"
  },
  "frontmatter": {
    "created": "2026-04-12",
    "updated": "2026-04-12",
    "author": "dojo-community",
    "audience": "developers, AI agents",
    "estimated_reading_time": "6 min",
    "prerequisites": [
      "azure/auth",
      "azure/resource-groups"
    ],
    "status": "living",
    "confidence": "high"
  },
  "repository": "https://github.com/Azure/azure-cli",
  "version": "1.0.0",
  "author": "dojo-community",
  "license": "MIT",
  "created": "2026-04-12T00:00:00Z",
  "updated": "2026-04-12T00:00:00Z",
  "status": "published"
}
